{
  "doc": "Tense combat loop in D minor: driving drums, saw bass, procedural lead.",
  "bpm": 128,
  "bars": 8,
  "key": "D",
  "scale": "minor",
  "swing": 0.05,
  "chords": ["i", "VI", "III", "VII"],
  "instruments": {
    "kick": "inst/kick",
    "snare": "inst/snare",
    "hat": "inst/hat",
    "bass": "inst/bass",
    "pad": "inst/pad",
    "lead": "inst/lead"
  },
  "tracks": [
    { "instrument": "kick", "pattern": "x...x...x..xx..." },
    { "instrument": "snare", "pattern": "....x.......x..x", "bars": [2, 3, 4, 5, 6, 7] },
    { "instrument": "hat", "pattern": "x.x.x.x.x.x.xxx.", "pan": 0.3 },
    { "instrument": "bass", "notes": "1 - . 1 . 1 5, - 1 - . 8 . 5 . 3", "octave": 2 },
    { "instrument": "pad", "chord": "x---------------", "octave": 3, "pan": -0.2, "gain": 0.8 },
    {
      "instrument": "lead",
      "generate": { "seed": 4, "density": 0.45, "length": 32 },
      "octave": 4,
      "bars": [4, 5, 6, 7],
      "pan": 0.15
    }
  ],
  "reverb": 0.15
}
